id,title,text,url
99,মার্কিন যুক্তরাষ্ট্র,"মার্কিন যুক্তরাষ্ট্র (ইংরেজি: United States of America; উচ্চারণ: ইউনাইটেড স্টেটস অফ আমেরিকা) উত্তর আমেরিকা মহাদেশে অবস্থিত পঞ্চাশটি  অঙ্গরাজ্য,  একটি যুক্তরাষ্ট্রীয় জেলা ও পাঁচটি টেরিটোরি এবং কিছু মাইনর আউটলেয়িং দ্বীপপুঞ্জ নিয়ে গঠিত যুক্তরাষ্ট্রীয় সাংবিধানিক প্রজাতন্ত্র। এই দেশটি ""আমেরিকা"" নামেও পরিচিত। উত্তর আমেরিকা মহাদেশের মধ্যভাগে অবস্থিত আটচল্লিশটি অঙ্গরাজ্য ও রাজধানী ওয়াশিংটন ডিসি অঞ্চলসহ মার্কিন যুক্তরাষ্ট্রের মূল ভূখণ্ডটি পশ্চিমে প্রশান্ত ও পূর্বে আটলান্টিক মহাসাগরদ্বয়ের মধ্যস্থলে অবস্থিত; এই অঞ্চলের উত্তরে কানাডা ও দক্ষিণে মেক্সিকো। মার্কিন যুক্তরাষ্ট্রের আলাস্কা অঙ্গরাজ্যটি উত্তর আমেরিকা মহাদেশের উত্তর-পশ্চিম কোণে অবস্থিত; আলাস্কার পূর্ব সীমান্তে কানাডা ও পশ্চিমে বেরিং প্রণালী পেরিয়ে রাশিয়া অবস্থিত। হাওয়াই অঙ্গরাজ্যটি মধ্য-প্রশান্ত মহাসাগরীয় অঞ্চলে অবস্থিত একটি দ্বীপপুঞ্জ। এছাড়াও ক্যারিবীয় সাগর ও প্রশান্ত মহাসাগরে পাঁচটি টেরিটরি মার্কিন যুক্তরাষ্ট্রের অধীন।
মার্কিন যুক্তরাষ্ট্রের আয়তন প্রায় ৯৮.৩ লক্ষ বর্গকিলোমিটার (৩৭.৯ লক্ষ বর্গমাইল)। দেশটির জনসংখ্যা প্রায় ৩২ কোটি ৮২ লক্ষ । সামগ্রিক আয়তনের হিসেবে মার্কিন যুক্তরাষ্ট্র বিশ্বের তৃতীয় অথবা চতুর্থ বৃহত্তম রাষ্ট্র। আবার স্থলভূমির আয়তন ও জনসংখ্যার হিসেবে যুক্তরাষ্ট্র বিশ্বের তৃতীয় বৃহত্তম দেশ। মার্কিন যুক্তরাষ্ট্রের সমাজ বিশ্বের সর্বাপেক্ষা বৈচিত্র্যমণ্ডিত বহুজাতিক সমাজব্যবস্থা। বহু দেশ থেকে বিভিন্ন জাতির মানুষের অভিবাসনের ফলে মার্কিন যুক্তরাষ্ট্র আজ একটি বহুসংস্কৃতিবাদী দেশ। মার্কিন যুক্তরাষ্ট্রের অর্থনীতি বিশ্বের বৃহত্তম জাতীয় অর্থনীতি। ২০০৮ সালে দেশের আনুমানিক জিডিপি হার ছিল ১৪.৪ ট্রিলিয়ন মার্কিন ডলার (নামমাত্র বিশ্ব জিডিপির এক চতুর্থাংশ এবং ক্রয় ক্ষমতা সমতায় বিশ্ব জিডিপির এক পঞ্চমাংশ)।
আমেরিকার আদিম অধিবাসীরা সম্ভবত এশীয় বংশোদ্ভুত। মার্কিন যুক্তরাষ্ট্রের মূল ভূখণ্ডে এরা কয়েক হাজার বছর ধরে বসবাস করছে। তবে নেটিভ আমেরিকানদের জনসংখ্যা ইউরোপীয় উপনিবেশ স্থাপনের পর থেকে মহামারী ও যুদ্ধবিগ্রহের প্রকোপে ব্যাপক হ্রাস পায়। প্রাথমিক পর্যায়ে আটলান্টিক মহাসাগর তীরস্থ উত্তর আমেরিকার তেরোটি ব্রিটিশ উপনিবেশ নিয়ে গঠিত হয়েছিল মার্কিন যুক্তরাষ্ট্র। ১৭৭৬ সালের ৪ জুলাই এই উপনিবেশগুলি একটি স্বাধীনতার ঘোষণাপত্র জারি করে। এই ঘোষণাপত্রের মাধ্যমে উপনিবেশগুলি তাদের আত্মনিয়ন্ত্রণের অধিকার ঘোষণা করে এবং একটি সমবায় সংঘের প্রতিষ্ঠা করে। আমেরিকার স্বাধীনতা যুদ্ধে এই বিদ্রোহী রাজ্যগুলি গ্রেট ব্রিটেনকে পরাস্ত করে। এই যুদ্ধ ছিল ঔপনিবেশিকতার ইতিহাসে প্রথম সফল ঔপনিবেশিক স্বাধীনতা যুদ্ধ। ১৭৮৭ সালের ১৭ সেপ্টেম্বর ক্যালিফোর্নিয়া কনভেনশন বর্তমান মার্কিন সংবিধানটি গ্রহণ করে। পরের বছর এই সংবিধান সাক্ষরিত হলে যুক্তরাষ্ট্র একটি শক্তিশালী কেন্দ্রীয় সরকার সহ একক প্রজাতন্ত্রে পরিণত হয়। ১৭৯১ সালে সাক্ষরিত এবং দশটি সংবিধান সংশোধনী সংবলিত বিল অফ রাইটস একাধিক মৌলিক নাগরিক অধিকার ও স্বাধীনতা সুনিশ্চিত করে।
ঊনবিংশ শতাব্দীতে যুক্তরাষ্ট্র ফ্রান্স, স্পেন, যুক্তরাজ্য, মেক্সিকো ও রাশিয়ার থেকে জমি অধিগ্রহণ করে এবং টেক্সাস প্রজাতন্ত্র ও হাওয়াই প্রজাতন্ত্র অধিকার করে নেয়। ১৮৬০-এর দশকে রাজ্যসমূহের অধিকার ও দাসপ্রথার বিস্তারকে কেন্দ্র করে গ্রামীণ দক্ষিণাঞ্চল ও শিল্পোন্নত উত্তরাঞ্চলের বিবাদ এক গৃহযুদ্ধের জন্ম দেয়। উত্তরাঞ্চলের বিজয়ের ফলে দেশের চিরস্থায়ী বিভাজন রোধ করা সম্ভব হয়। এরপরই যুক্তরাষ্ট্রে দাসপ্রথা আইনত রদ করা হয়। ১৮৭০-এর দশকেই মার্কিন অর্থনীতি বিশ্বের বৃহত্তম অর্থনীতির শিরোপা পায়। স্পেন-মার্কিন যুদ্ধ ও প্রথম বিশ্বযুদ্ধ সামরিক শক্তি হিসেবে মার্কিন যুক্তরাষ্ট্রকে প্রতিষ্ঠা দান করে। দ্বিতীয় বিশ্বযুদ্ধের সময় এই দেশ প্রথম পরমাণু শক্তিধর রাষ্ট্র হিসেবে আত্মপ্রকাশ করে এবং রাষ্ট্রসংঘ নিরাপত্তা পরিষদে স্থায়ী সদস্যপদ লাভ করে। শীতল যুদ্ধের শেষভাগে এবং সোভিয়েত ইউনিয়নের পতনের পর মার্কিন যুক্তরাষ্ট্র বিশ্বের একমাত্র মহাশক্তিধর রাষ্ট্রে পরিণত হয়। বিশ্বের মোট সামরিক ব্যয়ের দুই-পঞ্চমাংশ খরচ করে এই দেশ। বর্তমানে মার্কিন যুক্তরাষ্ট্র বিশ্বের অন্যতম প্রধান অর্থনৈতিক, রাজনৈতিক ও সাংস্কৃতিক শক্তিধর রাষ্ট্র। ১৯৩০ এর দশকে ও একবিংশ শতকের প্রথম দশকের শেষে আমেরিকার অর্থনীতি 'অর্থনেতিক মহামন্দা' বা 'গ্রেট ডিপ্রেশন'র শিকার হয়।",https://bn.wikipedia.org/wiki/%E0%A6%AE%E0%A6%BE%E0%A6%B0%E0%A7%8D%E0%A6%95%E0%A6%BF%E0%A6%A8_%E0%A6%AF%E0%A7%81%E0%A6%95%E0%A7%8D%E0%A6%A4%E0%A6%B0%E0%A6%BE%E0%A6%B7%E0%A7%8D%E0%A6%9F%E0%A7%8D%E0%A6%B0
100,পায়ুসঙ্গম,"পায়ুসঙ্গম বা পায়ুকাম হচ্ছে সাধারণত যৌন-আনন্দ লাভের জন্য উত্থিত শিশ্ন কোনো ব্যক্তির পায়ুপথে প্রবেশকরণ ও সঞ্চালনাকরণ। পায়ুসম্পর্কিত অন্যান্য যৌনক্রিয়াগুলোর মধ্যে রয়েছে পায়ুপথে অঙ্গুলিসঞ্চালন, পায়ুপথে কৃত্রিম শিশ্ন ঢোকানোসহ পায়ুলেহন এবং পেগিং। যদিও পায়ুসঙ্গম বলতে প্রধানত পায়ুপথে শিশ্ন প্রবিষ্টকরণকেই বোঝানো হয়, এবং পায়ুকাম শব্দটিও মূলত অনুরূপ ক্রিয়া বোঝাতেই ব্যবহৃত হয়ে থাকে তবে আবার পায়ুকাম শব্দটি পায়ুদ্বারসম্পর্কিত অন্যান্য যৌনক্রিয়া বোঝাতেও ব্যবহৃত হতে পারে শুধু 'স্বপায়ুমেহন' (পায়ুপথে নিজ অঙ্গুলি প্রবেশ) ক্রিয়া ব্যতীত কারণ এটি হস্তমৈথুনের কাতারে পড়ে কিংবা এটাকে স্বপায়ুকামও বলা হতে পারে।
পায়ুসঙ্গম সাধারণত পুরুষ-পুরুষ যৌনসংসর্গের জন্য সুপরিচিত যদিও বিষমকামিতায়ও পায়ুসঙ্গম প্রচলিত। নারী-নারী যৌনসংসর্গেও পায়ুসঙ্গম বন্ধনীযুক্ত কৃত্রিম শিশ্ন দ্বারা করা হয়। যার পায়ুপথে শিশ্ন প্রবেশ করানো হবে তিনি তার পায়ুর স্নায়ুতন্ত্রের কারণে ব্যথা বা কষ্ট পেতে পারেন আবার আনন্দও পেতে পারেন, পুরুষের পায়ুপথে যৌনানন্দ আসতে পারে তাদের প্রোস্টেটের পরোক্ষ উদ্দীপনার মাধ্যমে আর একজন নারীর পায়ুতে যৌনানন্দ আসতে পারে তার ভগাঙ্কুর বা যোনিপথের কোনো একটা জায়গা (জি-স্পট) এর পরোক্ষ উদ্দীপনার মাধ্যমে, এছাড়াও নারীদের আরো সংবেদী স্নায়ুর কারণেও আনন্দ আসতে পারে তবে এসব আনন্দ কারো পায়ুতেই স্থায়ী হয়না। যদিও, পায়ুসঙ্গম অধিকাংশ ক্ষেত্রেই পায়ুতে ব্যথাদায়ক, কখনো কখনো এই ব্যথা তীব্রও হতে পারে এবং চিকিৎসকরাও পায়ুপথে শিশ্নের প্রবেশকে পায়ুপথের জন্য ব্যথা প্রদায়ক এবং ক্ষতিকারক হিসেবে অভিহিত করে থাকেন।
অন্য সব যৌনক্রিয়ার চেয়ে পায়ুসঙ্গমে যৌনবাহিত রোগ হবার সম্ভাবনা সবচেয়ে বেশি হয়ে থাকে, পায়ুসঙ্গমকে অন্যান্য যৌনক্রিয়ার তুলনায় সবচেয়ে ঝুঁকিপূর্ণ যৌনক্রিয়া বলা হয়; প্রাকৃতিক ভাবেই পায়ুপথ শিশ্ন প্রবেশের জন্য উপযুক্ত পথ নয় কারণ পায়ুপথ প্রাকৃতিক ভাবে যৌনাঙ্গ নয় আর এই জন্যেই পায়ুপথে শিশ্নের প্রবেশ পায়ুপথের ক্ষতি ডেকে আনে। পায়ুপথে যোনিপথের মত প্রাকৃতিক পিচ্ছিলতা থাকেনা। পায়ুপথে শিশ্নের প্রবেশের ফলে পায়ুপথের টিস্যু সহজে ছিঁড়ে যায়, বিশেষ করে তখন যখন পায়ুকাম করার সময় পায়ুপথে লুব্রিক্যান্ট ব্যবহার করা না হয় যদিও লুব্রিক্যান্ট ব্যবহার করলেও পায়ুপথের টিস্যু যে ছিঁড়ে যাবেনা এরকমটা নিশ্চয়তা দিয়ে বলা যায়না। যিনি শিশ্ন প্রবেশ করান তার ক্ষেত্রে শিশ্নে কনডম পরিধান ছাড়া পায়ুপথে শিশ্ন প্রবেশ ঝুঁকিপূর্ণ হিসেবে বিবেচিত হয়, এবং সেইজন্যে স্বাস্থ্য বিষয়ক সংস্থাসমূহ যেমন বিশ্ব স্বাস্থ্য সংস্থা পায়ুসঙ্গম করার ক্ষেত্রে নিরাপদ যৌনতা অবলম্বন করতে বলে। যদিও যার পায়ুতে শিশ্ন প্রবেশ করানো হয় তার পায়ুর ক্ষতি এড়ানো যায়না; পায়ুসঙ্গমের ফলে পায়ুতে অর্শরোগ হয় এবং পায়ুসঙ্গমের ক্ষেত্রে পায়ুপথের অভ্যন্তরে শিশ্ন প্রবেশের পর সঞ্চালনাকরণের ফলে পায়ুপথে ক্ষত হয়ে যায় এবং এতে পায়ুপথের অভ্যন্তরে ঘা হয়ে যাওয়ার সম্ভাবনা থাকে, তাছাড়া হিউম্যান প্যাপিলোমা ভাইরাস (বা সংক্ষেপে এইচপিভি) পায়ুপথে শিশ্নের প্রবেশের ফলে পায়ুপথের ভেতরে বাসা বাঁধে এবং এতে মানুষের পায়ুপথে ক্যান্সার হয়।
পায়ুসঙ্গম সম্পর্কে প্রায়শই শক্ত মতবাদ প্রকাশ করা হয়। বিভিন্ন সংস্কৃতিতে এটি বিতর্কিত বিশেষ করে ধর্মীয় আইনসমূহে। এটা সাধারণত এই কারণে যে পায়ুসঙ্গম বলতে সাধারণত দুইজন পুরুষের যৌনসঙ্গম বোঝায় এবং যৌনতার মূল অর্থ যেখানে শুধুই 'বাচ্চা জন্মদান' এর জন্য - এরকমটা শেখানো হয়। এটাকে ট্যাবু বা অপ্রাকৃতিক বলা হতে পারে, এবং কিছু কিছু রাষ্ট্রে আইনত দণ্ডনীয় অপরাধ, যেখানে নিতম্বে বেত্রাঘাত কিংবা মৃত্যুদণ্ডের মত বড় ধরনের শাস্তিও দেওয়া হতে পারে। অনেক মানুষ পায়ুসঙ্গমকে প্রাকৃতিক এবং যৌনমিলনের অন্যতম একটি আনন্দদায়ক মাধ্যম হিসেবে মনে করেন যদিও যার পায়ুতে শিশ্ন প্রবেশ করানো হয় তিনি অধিকাংশ ক্ষেত্রেই পায়ুতে আনন্দ অনুভব করেন না। অনেকেই পায়ুকামকে তাদের যৌনজীবনের একটি বর্ধিত অংশ হিসেবেও মনে করেন।",https://bn.wikipedia.org/wiki/%E0%A6%AA%E0%A6%BE%E0%A6%AF%E0%A6%BC%E0%A7%81%E0%A6%B8%E0%A6%99%E0%A7%8D%E0%A6%97%E0%A6%AE
101,জাতীয় স্মৃতিসৌধ,"জাতীয় স্মৃতিসৌধ বাংলাদেশের স্বাধীনতা যুদ্ধে নিহত মুক্তিযোদ্ধা ও নিহত বেসামরিক বাঙালি ও অবাঙালিদের স্মৃতির উদ্দেশ্যে নিবেদিত একটি স্মারক স্থাপনা। এটি ঢাকার সাভারে অবস্থিত। স্মৃতিসৌধে সাতটি স্তম্ভ রয়েছে যা বাংলাদেশের মুক্তি সংগ্রামের প্রধান সাতটি আন্দোলনের নিদর্শন বহন করে।
এর নকশা প্রণয়ন করেন স্থপতি সৈয়দ মাইনুল হোসেন। এখানে মুক্তিযুদ্ধে নিহতদের দশটি গণকবর রয়েছে। বিদেশি রাষ্ট্রনায়কগণ সরকারিভাবে বাংলাদেশ সফরে আগমন করলে এই স্মৃতিসৌধে শ্রদ্ধা নিবেদন রাষ্ট্রাচারের অন্তর্ভুক্ত।",https://bn.wikipedia.org/wiki/%E0%A6%9C%E0%A6%BE%E0%A6%A4%E0%A7%80%E0%A6%AF%E0%A6%BC_%E0%A6%B8%E0%A7%8D%E0%A6%AE%E0%A7%83%E0%A6%A4%E0%A6%BF%E0%A6%B8%E0%A7%8C%E0%A6%A7
102,অকাল বীর্যপাত,"অকাল বীর্যস্খলন বা দ্রুতস্খলন হলো যৌনসঙ্গমকালে পুরুষের দ্রুত বীর্যপাত হওয়়া। এটি একটি সাধারণ যৌনগত সমস্যা। কিছু বিশেষজ্ঞের মতে প্রতি তিনজন পুরুষের মধ্যে একজনকে এ সমস্যায় আক্রান্ত হতে দেখা যায় । স্ত্রী যোনীতে পুরুষাঙ্গ প্রবেশের পর অঙ্গ চালনার পরিণতি হিসেবে বীর্যপাত হয়ে থাকে। যোনিতে লিঙ্গ প্রবেশের সময় থেকে বীর্যপাত অবধি সময়কে বলা হয় বীর্যধারণ কাল। কতক্ষণ অঙ্গচালনার পর বীর্যপাত হবে তার কোন সুনির্দ্দিষ্ট বা আদর্শস্থানীয় সময় নেই। পুরুষে পুরুষে, বয়সের তারতম্যে বা পরিবেশভেদে বীর্যধারণ ক্ষমতা বিভিন্ন হতে দেখা যায়। তবে নিয়মিত যদি যোনীতে লিঙ্গ প্রবেশের পূর্বে বা অব্যবহিত পরেই অপ্রতিরোধ্যভাবে বীর্যপাত হয়ে যায় তবে তা দ্রুতস্খলন সমস্যা হিসেবে বিবেচিত হবে। এটি একটি যৌনসমস্যা কেননা এর ফলে পুরুষ প্রযোজনীয় সময় ধরে অঙ্গচালনার সুখ থেকে বঞ্চিত হয়। অপর দিকে অকাল বীর্যপাতের দরূণ পুরুষাঙ্গ নেতিয়ে পড়ে বলে অঙ্গ চালনা আর সম্ভব হয় না যার ফলে স্ত্রীর চরমানন্দ লাভের আগেই সঙ্গমের সমাপ্তি হয়।
পুরুষের স্বাভাবিক বীর্যপাতের সময় ৪-৮ মিনিট। এর বিপরীত রোগ হচ্ছে বিলম্বিত বীর্যপাত। এই ধরনের সমস্যাগ্রস্ত পুরুষেরা সাধারণত মানসিক বিষন্নতায় ভোগে এবং লজ্জাজনক পরিস্থিতির ভয়ে শারীরিক সম্পর্ক এড়িয়ে চলার চেষ্টা করে।  পুরুষের তুলনায় নারীদের মধ্যে এই ধরনের সমস্যা খুবই কম পাওয়া যায়। কিছু সমস্যায় দেখা গেছে পুরুষের এই সমস্যা অনেক সময় নারীসঙ্গীর মধ্যে অবসাদ সৃষ্টি করে।",https://bn.wikipedia.org/wiki/%E0%A6%85%E0%A6%95%E0%A6%BE%E0%A6%B2_%E0%A6%AC%E0%A7%80%E0%A6%B0%E0%A7%8D%E0%A6%AF%E0%A6%AA%E0%A6%BE%E0%A6%A4
103,বাংলা ভাই,"সিদ্দিকুল ইসলাম ওরফে বাংলা ভাই (১৯৭০-৩০ মার্চ ২০০৭) একজন বাংলাদেশি সন্ত্রাসবাদী। তিনি জাগ্রত মুসলিম জনতা, বাংলাদেশ নামক উগ্রপন্থী সংগঠনের নেতা, এবং বোমা হামলা, হত্যা সহ বিভিন্ন ধরনের অপরাধে অভিযুক্ত। ৬ মার্চ ২০০৬ খ্রিষ্টাব্দে পুলিশ ও র‌্যাব এর সম্মিলিত অভিযানে তিনি গ্রেপ্তার হন। পরবর্তীতে বোমা হামলার অপরাধে তাকে তার সহযোগীদের সহ মৃত্যুদণ্ড প্রদান করা হয়।",https://bn.wikipedia.org/wiki/%E0%A6%AC%E0%A6%BE%E0%A6%82%E0%A6%B2%E0%A6%BE_%E0%A6%AD%E0%A6%BE%E0%A6%87
