id,title,text,url
494,সাকিব আল হাসান,"সাকিব আল হাসান (জন্ম: ২৪ মার্চ ১৯৮৭) একজন বাংলাদেশী ক্রিকেটার ও রাজনীতিবিদ। তিনি টেস্ট, ওডিআই ও টি-টোয়েন্টিতে বাংলাদেশ জাতীয় ক্রিকেট দলের সাবেক অধিনায়ক এবং মাগুরা-১ আসনের সাবেক সাংসদ। তিনি বামহাতি মিডল অর্ডার ব্যাটার এবং বামহাতি অর্থোডক্স স্পিনার। বাংলাদেশের হয়ে খেলা সর্বশ্রেষ্ঠ ক্রিকেটার হিসেবে বিবেচিত সাকিবকে বিশ্বের অন্যতম সেরা অল-রাউন্ডার বলে গণ্য করা হয়। ১০ বছর ধরে শীর্ষ অল-রাউন্ডার এর রেকর্ডের অধিকারী সাকিব এখনো একদিনের আন্তর্জাতিক ও টেস্ট ফরম্যাটে সর্বোচ্চ র‍্যাংকিং ধরে রেখেছেন। তিনি ইএসপিএন দ্বারা বিশ্বের ৯০তম বিখ্যাত ক্রীড়াবিদ হিসেবে স্থান পেয়েছেন। ২০২২ সাল পর্যন্ত, তিনি টি২০ বিশ্বকাপে সবচেয়ে বেশি উইকেট নিয়েছেন।
২০০৬ সালের আগস্ট মাসে জিম্বাবুয়ের বিপক্ষে একদিনের আন্তর্জাতিক ম্যাচে তার অভিষেক হয়। সাকিব বাংলাদেশ ক্রীড়া শিক্ষা প্রতিষ্ঠান (বিকেএসপি)- এর একজন প্রাক্তন শিক্ষার্থী। সাকিব ২০১৫ সালের জানুয়ারিতে আইসিসির খেলোয়াড়দের র‍্যাংকিং অনুসারে টেস্ট, ওডিআই ও টি২০ প্রত্যেক ক্রিকেট সংস্করণে প্রথম ও একমাত্র ক্রিকেটার হিসেবে এক নম্বর অল-রাউন্ডার হওয়ার গৌরব অর্জন করেন। তিনি প্রথম বাংলাদেশী ক্রিকেটার হিসেবে একদিনের ক্রিকেটে ৪,০০০ করার গৌরব অর্জন করেন এবং ২০১৭ সালের ১৩ই জানুয়ারি টেস্টে সর্বোচ্চ ব্যক্তিগত রান (২১৭) সংগ্রাহক হন। তিনি টি২০তে বাংলাদেশের দ্বিতীয় ব্যাটসম্যান হিসেবে ১০০০ রান পূর্ণ করেন ৷ এছাড়া দ্বিতীয় অলরাউন্ডার হিসেবে টি২০তে ১০০০ রান ও ৫০ উইকেট লাভ করেন। ২০১৯ সালের জুনে তিনি দ্রুততম খেলোয়াড় হিসেবে মাত্র ১৯৯ ম্যাচে ৫,০০০ রান ও ২৫০ উইকেট নেওয়ার কৃতিত্ব অর্জন করেন।
সাকিব আল হাসান বিশ্বসেরা ক্রিকেট অলরাউন্ডারের মধ্যে একজন, যিনি একই সাথে দীর্ঘদিন তিন ফরমেটের (টেস্ট, ওয়ান-ডে, টি-২০) ক্রিকেটের শ্রেষ্ঠ, নাম্বার ওয়ান অলরাউন্ডার হিসাবে ছিলেন। ক্রিকেট ইতিহাসে এমন রেকর্ড শুধুমাত্র সাকিবের।
তিনি ২০২৪ সালে অসহযোগ আন্দোলনের মাধ্যমে জাতীয় সংসদ বিলুপ্তের মাধ্যমে সংসদ সদস্য পদ হারান।",https://bn.wikipedia.org/wiki/%E0%A6%B8%E0%A6%BE%E0%A6%95%E0%A6%BF%E0%A6%AC_%E0%A6%86%E0%A6%B2_%E0%A6%B9%E0%A6%BE%E0%A6%B8%E0%A6%BE%E0%A6%A8
0,বিশ্ব শিক্ষক দিবস,"বিশ্ব শিক্ষক দিবস প্রতি বছর ৫ অক্টোবর বিশ্বব্যাপী পালন করা হয়। ১৯৯৫ সাল থেকে এটি পালিত হয়ে আসছে।
ইউনেস্কোর মতে, বিশ্ব শিক্ষক দিবস শিক্ষা ও উন্নয়নের ক্ষেত্রে শিক্ষকদের অসামান্য অবদানের স্বীকৃতি স্বরূপ পালন করা হয়।
বিশ্বের ১০০টি দেশে এই দিবসটি পালিত হয়ে থাকে। এই দিবসটি পালনে এডুকেশন ইন্টারন্যাশনাল ও তার সহযোগী ৪০১টি সদস্য সংগঠন মূল ভূমিকা রাখে। দিবসটি উপলক্ষে ইআই প্রতি বছর একটি প্রতিপাদ্য বিষয় নির্ধারণ করে থাকে যা জনসচেতনতা বৃদ্ধির সাথে সাথে শিক্ষকতা পেশার অবদানকেও স্মরণ করিয়ে দেয়।",https://bn.wikipedia.org/wiki/%E0%A6%AC%E0%A6%BF%E0%A6%B6%E0%A7%8D%E0%A6%AC_%E0%A6%B6%E0%A6%BF%E0%A6%95%E0%A7%8D%E0%A6%B7%E0%A6%95_%E0%A6%A6%E0%A6%BF%E0%A6%AC%E0%A6%B8
1,প্রধান পাতা,,https://bn.wikipedia.org/wiki/%E0%A6%AA%E0%A7%8D%E0%A6%B0%E0%A6%A7%E0%A6%BE%E0%A6%A8_%E0%A6%AA%E0%A6%BE%E0%A6%A4%E0%A6%BE
2,একিউএম বদরুদ্দোজা চৌধুরী,"আবুল কাসেম মোহাম্মদ বদরুদ্দোজা চৌধুরী বা বি.চৌধুরী (১ নভেম্বর ১৯৩০ – ৫ অক্টোবর ২০২৪) ছিলেন একজন বাংলাদেশী রাজনীতিবিদ ও চিকিৎসক। জিয়াউর রহমানের শাসনামলে তিনি উপ-প্রধানমন্ত্রী ছিলেন। ২০০১ সালে বাংলাদেশ জাতীয়তাবাদী দল (বিএনপি) ক্ষমতায় আসার পর তিনি পররাষ্ট্রমন্ত্রী হন। এর কিছুদিন পর ২০০১ সালের নভেম্বর মাসে তিনি বাংলাদেশের রাষ্ট্রপতি হিসেবে দায়িত্ব গ্রহণ করেন। তিনি একজন স্বনামধন্য চিকিৎসক। এছাড়া তিনি একজন লেখক, প্রাবন্ধিক, নাট্যকার, উপস্থাপক এবং সুবক্তা। ২০০২ সালে সৃষ্ট এক বিতর্কিত ঘটনার জের ধরে তিনি রাষ্ট্রপতির পদ থেকে পদত্যাগ করতে বাধ্য হন ও পরবর্তীকালে আরেকটি রাজনৈতিক দল বিকল্প ধারা বাংলাদেশ গঠন করেন।",https://bn.wikipedia.org/wiki/%E0%A6%8F%E0%A6%95%E0%A6%BF%E0%A6%89%E0%A6%8F%E0%A6%AE_%E0%A6%AC%E0%A6%A6%E0%A6%B0%E0%A7%81%E0%A6%A6%E0%A7%8D%E0%A6%A6%E0%A7%8B%E0%A6%9C%E0%A6%BE_%E0%A6%9A%E0%A7%8C%E0%A6%A7%E0%A7%81%E0%A6%B0%E0%A7%80
3,এক্স এক্স এক্স এক্স (অ্যালবাম),"এক্স এক্স এক্স এক্স (ইংরেজি: XXXX) কানাডীয় নৃত্য-পাঙ্ক ব্যান্ড ইউ সে পার্টি দলের তৃতীয় পূর্ণ দৈর্ঘ্যের অ্যালবাম (পূর্বনাম ইউ সে পার্টি! উই সে ডাই!) যা ২৯ সেপ্টেম্বর, ২০০৯ সালে প্রকাশিত হয়। এটি ছিল ব্যান্ডের মূল দীর্ঘ নাম এবং ড্রামার ডেভন ক্লিফোর্ড (যিনি ২০১০ সালের এপ্রিল মাসে মারা যান)-এর সাথে করা শেষ অ্যালবাম।
অ্যালবামের শিরোনাম ছাড়াও, ""এক্সএক্সএক্সএক্স"" শব্দটি অ্যালবামের বেশ কয়েকটি গানের শিরোনামেও উপস্থিত হয়। প্রতিটি গানে, চারটি এক্স ""প্রেম"" শব্দটি উপস্থাপন করে। সিবিসি রেডিও ৩-এর সাথে একটি সাক্ষাৎকারে, ব্যান্ডের কণ্ঠশিল্পী বেকি নিনকোভিচ ব্যাখ্যা করেছিলেন যে ব্যান্ডের প্রথম ইপি ড্যানস্ক ওয়াডের জন্য কভার আর্ট চূড়ান্ত করার সময়, তিনি এটিতে একটি ব্যক্তিগত ""ভালবাসার চিহ্ন"" রেখে যেতে চেয়েছিলেন এবং চারটি ছোট এক্স দিয়ে স্বাক্ষর করার সিদ্ধান্ত নিয়েছিলেন।
অ্যালবামটি পোলারিস সঙ্গীত পুরস্কার, ২০১০-এর জন্য একটি দীর্ঘ তালিকাভুক্ত মনোনীত ছিল।",https://bn.wikipedia.org/wiki/%E0%A6%8F%E0%A6%95%E0%A7%8D%E0%A6%B8_%E0%A6%8F%E0%A6%95%E0%A7%8D%E0%A6%B8_%E0%A6%8F%E0%A6%95%E0%A7%8D%E0%A6%B8_%E0%A6%8F%E0%A6%95%E0%A7%8D%E0%A6%B8_(%E0%A6%85%E0%A7%8D%E0%A6%AF%E0%A6%BE%E0%A6%B2%E0%A6%AC%E0%A6%BE%E0%A6%AE)
4,বাংলাদেশ,"বাংলাদেশ () দক্ষিণ এশিয়ার একটি স্বাধীন সার্বভৌম রাষ্ট্র। বাংলাদেশের সাংবিধানিক নাম গণপ্রজাতন্ত্রী বাংলাদেশ। ভৌগোলিকভাবে বাংলাদেশের পশ্চিমে ভারতের পশ্চিমবঙ্গ, উত্তরে পশ্চিমবঙ্গ, আসাম ও মেঘালয়, পূর্ব সীমান্তে আসাম, ত্রিপুরা ও মিজোরাম, দক্ষিণ-পূর্ব সীমান্তে মিয়ানমারের চিন ও রাখাইন রাজ্য এবং দক্ষিণ উপকূলে  বঙ্গোপসাগর অবস্থিত। ভৌগোলিকভাবে পৃথিবীর বৃহত্তম ব-দ্বীপের সিংহভাগ অঞ্চল জুড়ে বাংলাদেশ ভূখণ্ড অবস্থিত। জনসংখ্যার বিচারে প্রায় ১৭ কোটিরও অধিক জনসংখ্যা নিয়ে বাংলাদেশ বিশ্বের ৮ম বৃহত্তম দেশ। নদীমাতৃক বাংলাদেশ ভূখণ্ডের উপর দিয়ে বয়ে গেছে ৫৭টি আন্তর্জাতিক নদী। বাংলাদেশের উত্তর-পূর্বে ও দক্ষিণ-পূর্বে টারশিয়ারি যুগের পাহাড় মেঘের সাথে মিশে আছে। বিশ্বের বৃহত্তম ম্যানগ্রোভ অরণ্য সুন্দরবন ও দীর্ঘতম প্রাকৃতিক সৈকত কক্সবাজার সমুদ্র সৈকত বাংলাদেশে অবস্থিত।
দক্ষিণ এশিয়ার প্রাচীন ও ধ্রুপদী যুগে বাংলাদেশ অঞ্চলটিতে বঙ্গ, পুণ্ড্র, গৌড়, গঙ্গাঋদ্ধি, সমতট ও হরিকেল নামক জনপদ গড়ে উঠেছিল। মৌর্য যুগে মৌর্য সাম্রাজ্যের একটি প্রদেশ ছিল অঞ্চলটি। জনপদগুলো নৌ-শক্তি ও সামুদ্রিক বাণিজ্যের জন্য বিখ্যাত ছিল। মধ্যপ্রাচ্য, রোমান সাম্রাজ্যে মসলিন ও রেশম বস্ত্র রপ্তানি করতো জনপদগুলো। প্রথম সহস্রাব্দে বাংলাদেশ অঞ্চলকে কেন্দ্র করে পাল সাম্রাজ্য, চন্দ্র রাজবংশ, সেন রাজবংশ গড়ে উঠেছিল। বখতিয়ার খলজির ১২০৪ সালে গৌড় জয়ের পরে ও পরবর্তীতে দিল্লি সালতানাত শাসনামলে এ অঞ্চলে ইসলাম ছড়িয়ে পড়ে। ইউরোপীয়রা শাহী বাংলাকে পৃথিবীর সবচেয়ে ধনী বাণিজ্যিক দেশ হিসেবে গণ্য করতো।
মুঘল আমলে বিশ্বের মোট অর্থনৈতিক উৎপাদনের (জিডিপি-র বৈশ্বিক সংস্করণ) ১২ শতাংশ উৎপন্ন হতো সুবাহ বাংলায়, যা তৎকালীন সমগ্র পশ্চিম ইউরোপের মোট অর্থনৈতিক উৎপাদনের চেয়ে বেশি ছিল। ১৭৫৭ সালে পলাশী যুদ্ধে বিজয়ের ফলে ইংরেজ ইস্ট ইন্ডিয়া কোম্পানি আনুষ্ঠানিকভাবে বাংলা অঞ্চলে শাসন শুরু করে। ১৭৬৫ থেকে ১৯৪৭ সাল পর্যন্ত বাংলাদেশ ভূখণ্ডটি প্রেসিডেন্সি বাংলার অংশ ছিল। ১৯৪৭-এ ভারত বিভাজনের পর বাংলাদেশ অঞ্চল পূর্ব বাংলা (১৯৪৭–১৯৫৬; পূর্ব পাকিস্তান, ১৯৫৬–১৯৭১) নামে নবগঠিত পাকিস্তান অধিরাজ্যের অন্তর্ভুক্ত হয়। ১৯৪৭ থেকে ১৯৫৬ পর্যন্ত বাংলা ভাষা আন্দোলনকে কেন্দ্র করে বাঙালি জাতীয়তাবাদের বিকাশ হলে পশ্চিম পাকিস্তানের বিবিধ রাজনৈতিক, সাংস্কৃতিক ও অর্থনৈতিক শোষণ, বৈষম্য ও নিপীড়নের বিরুদ্ধে ভারতের সহায়তায় গণতান্ত্রিক ও সশস্ত্র সংগ্রামের মধ্য দিয়ে ৩০ লক্ষ শহীদের বিনিময়ে ১৯৭১ সালে পূর্ব পাকিস্তান বাংলাদেশ নামক স্বাধীন ও সার্বভৌম জাতিরাষ্ট্র হিসাবে প্রতিষ্ঠিত হয়। স্বাধীনতা পরবর্তী সময়ে দারিদ্র্যপীড়িত বাংলাদেশে বিভিন্ন সময় ঘটেছে দুর্ভিক্ষ ও প্রাকৃতিক দুর্যোগ; এছাড়াও প্রলম্বিত রাজনৈতিক অস্থিতিশীলতা ও পৌনঃপুনিক সামরিক অভ্যুত্থান এদেশের সামগ্রিক রাজনৈতিক স্থিতিশীলতা বারংবার ব্যাহত করেছে। নব্বইয়ের স্বৈরাচার বিরোধী আন্দোলনের মধ্য দিয়ে ১৯৯১ সালে সংসদীয় শাসনব্যবস্থা পুনঃপ্রতিষ্ঠিত হয় যার ধারাবাহিকতা আজ অবধি বিদ্যমান। সকল প্রতিকূলতা সত্ত্বেও গত তিন দশকে বাংলাদেশের অর্থনৈতিক প্রগতি ও সমৃদ্ধি সারা বিশ্বে স্বীকৃতি লাভ করেছে।
জনসংখ্যায় বিশ্বে অষ্টম বৃহত্তম দেশ বাংলাদেশ, যদিও আয়তনে বিশ্বে ৯২ তম। ৬টি ক্ষুদ্র দ্বীপ ও নগররাষ্ট্রের পরেই বিশ্বের সবচেয়ে ঘনবসতিপূর্ণ দেশ বাংলাদেশ। মাত্র ৫৬ হাজার বর্গমাইলেরও (প্রায় ১৪৮ হাজার বর্গকিলোমিটার) কম এই ক্ষুদ্রায়তনের দেশটির প্রাক্কলিত (২০১৮) জনসংখ্যা ১৮ কোটির বেশি অর্থাৎ প্রতি বর্গমাইলে জনবসতি ২৮৮৯ জন (প্রতি বর্গ কিলোমিটারে ১১৪০ জন)। ১ কোটির অধিক জনসংখ্যাবিশিষ্ট দেশগুলির মধ্যে বাংলাদেশ বিশ্বের সবচেয়ে ঘনবসতিপূর্ন দেশ। দেশের জনসংখ্যার প্রায় ৯৯% মানুষের মাতৃভাষা বাংলা; সাক্ষরতার হার প্রায় ৭৫.২%।
২০১৭–১৮ অর্থবছরে চলতি বাজারমূল্যে বাংলাদেশের মোট দেশজ উৎপাদনের (জিডিপি) পরিমাণ ছিল ২২,৫০,৪৭৯ কোটি টাকা (২৬১.২৭ বিলিয়ন মার্কিন ডলার), যা ২০১৮–১৯ অর্থবছরে বৃদ্ধি লাভ করে ২৮৫.৮২ বিলিয়ন মার্কিন ডলার উন্নীত হবে বলে প্রাক্কলন করা হয়েছে। ২০১৭–১৮ অর্থবছরে বাংলাদেশের মানুষের মাথাপিছু গড় বার্ষিক আয় ছিল ১৭৫২ ডলার। সরকার প্রাক্কলন করেছে যে, ২০১৮–১৯ অর্থবছরে মাথাপিছু আয় দাঁড়াবে ১৯৫৬ ডলার বা ১ লাখ ৬০ হাজার ৩৯২ টাকা। দারিদ্র্যের হার ২০.৫ শতাংশ, অতিদরিদ্র মানুষের সংখ্যা ১০.৫ শতাংশ এবং বার্ষিক দারিদ্র্য হ্রাসের হার ১.৫ শতাংশ। এই উন্নয়নশীল দেশটি প্রায় দুই দশক যাবৎ বার্ষিক ৫ থেকে ৬.২ শতাংশ হারে অর্থনৈতিক প্রবৃদ্ধি অর্জনপূর্বক ""পরবর্তী একাদশ"" অর্থনীতিসমূহের তালিকায় স্থান করে নিয়েছে। রাজধানী ঢাকা ও অন্যান্য শহরের পরিবর্ধন বাংলাদেশের এই উন্নতির চালিকাশক্তিরূপে কাজ করছে। এর কেন্দ্রবিন্দুতে কাজ করেছে একটি উচ্চাকাঙ্ক্ষী মধ্যবিত্ত শ্রেণীর ত্বরিত বিকাশ এবং একটি সক্ষম ও সক্রিয় উদ্যোক্তা শ্রেণির আর্বিভাব। বাংলাদেশের রপ্তানিমুখী তৈরি পোশাক শিল্প সারা বিশ্বে বিশেষভাবে প্রসিদ্ধ। জনশক্তি রপ্তানিও দেশটির অন্যতম অর্থনৈতিক স্তম্ভ। বিশ্ব ব্যাংকের প্রাক্কলন এই যে ২০১৮–২০ এই দুই অর্থ বছরে বাংলাদেশের অর্থনীতি প্রতি বছর গড়ে ৬.৭ শতাংশ হারে বৃদ্ধি লাভ করবে।
গঙ্গা-ব্রহ্মপুত্রের উর্বর অববাহিকায় অবস্থিত এই দেশটিতে প্রায় প্রতি বছর মৌসুমী বন্যা হয়; আর ঘূর্ণিঝড়ও খুব সাধারণ ঘটনা। নিম্ন আয়ের এই দেশটির প্রধান সমস্যা পরিব্যাপ্ত দারিদ্র্য গত দুই দশকে অনেকাংশে নিয়ন্ত্রণে এসেছে, সাক্ষরতার হার বৃদ্ধি পেয়েছে দ্রুত, জন্ম নিয়ন্ত্রণ কার্যক্রমে অর্জিত হয়েছে অভূতপূর্ব সফলতা। এছাড়া আন্তর্জাতিক মানব সম্পদ উন্নয়ন সূচকে বাংলাদেশ দৃষ্টান্তমূলক অগ্রগতি অর্জনে সক্ষম হয়েছে। তবে বাংলাদেশ এখনো বেশ কিছু গুরুত্বপূর্ণ চ্যালেঞ্জ মোকাবেলা করছে যার মধ্যে রয়েছে পরিব্যাপ্ত পরিবারতন্ত্র, রাজনৈতিক ও প্রশাসনিক দুর্নীতি, বিশ্বায়নের প্রেক্ষাপটে অর্থনৈতিক প্রতিযোগিতা এবং ভূমণ্ডলীয় উষ্ণতা বৃদ্ধিের ফলে সমুদ্রতলের উচ্চতা বৃদ্ধির ফলশ্রুতিতে তলিয়ে যাবার শঙ্কা। তাছাড়া একটি সর্বগ্রহণযোগ্য নির্বাচন ব্যবস্থার রূপ নিয়ে নতুন ভাবে সামাজিক বিভাজনের সৃষ্টি হয়েছে। বাংলাদেশে সংসদীয় গণতান্ত্রিক সরকার ব্যবস্থা প্রচলিত। বাংলাদেশ দক্ষিণ এশীয় আঞ্চলিক সহযোগিতা সংস্থা ও বিমসটেক-এর প্রতিষ্ঠাতা সদস্য। এছাড়া দেশটি জাতিসংঘ, বিশ্ব বাণিজ্য সংস্থা, বিশ্ব শুল্ক সংস্থা, কমনওয়েলথ অফ নেশনস, উন্নয়নশীল ৮টি দেশ, জোট-নিরপেক্ষ আন্দোলন এবং ওআইসি ইত্যাদি আন্তর্জাতিক সংস্থার সক্রিয় সদস্য।",https://bn.wikipedia.org/wiki/%E0%A6%AC%E0%A6%BE%E0%A6%82%E0%A6%B2%E0%A6%BE%E0%A6%A6%E0%A7%87%E0%A6%B6
