id,title,text,url
235,গণতন্ত্র,"গণতন্ত্র বলতে কোনো জাতিরাষ্ট্রের (অথবা কোনোও সংগঠনের) এমন একটি শাসনব্যবস্থাকে বোঝায় যেখানে নীতিনির্ধারণ বা সরকারি প্রতিনিধি নির্বাচনের ক্ষেত্রে প্রত্যেক নাগরিক বা সদস্যের সমান ভোটাধিকার থাকে। ইংরেজি 'Democracy' শব্দটি গ্রিক শব্দ Demo Kratia থেকে উদ্ভূত হয়েছে যা গ্রিক শব্দ 'Demos' এবং 'Kratia' শব্দ দুটির সমন্বয়ে সৃষ্ট। 'Demos'শব্দের অর্থ হল 'জনগন' এবং 'Kratia'শব্দের অর্থ হল 'শাসন'। গণতন্ত্রে আইন প্রস্তাবনা, প্রণয়ন ও তৈরীর ক্ষেত্রে সকল নাগরিকের অংশগ্রহণের সমান সু্যোগ রয়েছে, যা সরাসরি বা নির্বাচিত প্রতিনিধির মাধ্যমে হয়ে থাকে। ""গণতন্ত্র"" পরিভাষাটি সাধারণভাবে একটি রাজনৈতিক রাষ্ট্রের ক্ষেত্রেই প্রয়োগ করা হলেও অন্যান্য সংস্থা বা সংগঠনের ক্ষেত্রেও এটি প্রযোজ্য হতে পারে, যেমন বিশ্ববিদ্যালয়, শ্রমিক ইউনিয়ন, রাষ্ট্র-মালিকানাধীন প্রতিষ্ঠান ইত্যাদি।",https://bn.wikipedia.org/wiki/%E0%A6%97%E0%A6%A3%E0%A6%A4%E0%A6%A8%E0%A7%8D%E0%A6%A4%E0%A7%8D%E0%A6%B0
236,আফগানিস্তান,"আফগানিস্তান (পশতু ভাষা/দারি: افغانستان, Afġānestān [avɣɒnesˈtɒn]), সরকারি নাম আফগানিস্তান ইসলামি আমিরাত, হলো পাহাড়ি স্থলবেষ্টিত রাষ্ট্র। এটি ইরান, পাকিস্তান, চীন, তাজিকিস্তান, উজবেকিস্তান, ও তুর্কমেনিস্তানের মধ্যস্থলে একটি ভূ-বেষ্টিত মালভূমির উপর অবস্থিত। আফগানিস্তানকে অনেক সময় দক্ষিণ এশিয়া এবং মধ্যপ্রাচ্যের  অংশ হিসেবেও গণ্য করা হয়। আফগানিস্তানের পূর্বে ও দক্ষিণে পাকিস্তান , পশ্চিমে ইরান, উত্তরে তুর্কমেনিস্তান, উজবেকিস্তান ও তাজিকিস্তান এবং উত্তর-পূর্বে চীন। আফগানিস্তান শব্দটির অর্থ ""আফগান (তথা পশতুন) জাতির দেশ""। আফগানিস্তান একটি রুক্ষ এলাকা যার অধিকাংশ এলাকা পর্বত ও মরুভূমি আবৃত।শুধু পার্বত্য উপত্যকা এবং উত্তরের সমভূমিতে গাছপালা দেখা যায়। এখানকার গ্রীষ্মকালীন আবহাওয়া গরম ও শুষ্ক এবং শীতকালে প্রচণ্ড শীত পড়ে। কাবুল দেশটির বৃহত্তম শহর ও রাজধানী।
আফগানিস্তান প্রাচীনকাল থেকেই এশিয়ার একটি গুরুত্বপূর্ণ অঞ্চল হিসেবে পরিচিত। বহু প্রাচীন বাণিজ্য ও বহিরাক্রমণ এই দেশের মধ্য দিয়েই সংঘটিত হয়েছে। শতাব্দীর পর শতাব্দী ধরে বহু লোক আফগানিস্তানের ভেতর দিয়ে চলাচল করেছেন এবং এদের মধ্যে কেউ কেউ এখানে বসতি স্থাপন করেছেন। দেশটির বর্তমান জাতিগত ও ভাষাগত বৈচিত্র্য এই ইতিহাসের সাক্ষ্য দেয়। আফগানিস্তানে বসবাসরত সবচেয়ে বড় জনগোষ্ঠী হল পশতুন জাতি। এরা আগে আফগান নামেও পরিচিত ছিল। তবে বর্তমানে আফগান বলতে কেবল পশতু নয়, বরং জাতি নির্বিশেষে রাষ্ট্রের সকল নাগরিককেই বোঝায়।",https://bn.wikipedia.org/wiki/%E0%A6%86%E0%A6%AB%E0%A6%97%E0%A6%BE%E0%A6%A8%E0%A6%BF%E0%A6%B8%E0%A7%8D%E0%A6%A4%E0%A6%BE%E0%A6%A8
237,আবু হানিফা,"আবু হানিফা আল-নোমান ইবনে সাবিত ইবনে যুতা ইবনে মারযুবান (৬৯৯ — ৭৬৭ সাল/৮০ — ১৪৮ হিজরি, আরবি: نعمان بن ثابت بن زوطا بن مرزبان), উপনাম ইমাম আবু হানিফা নামেই সমধিক পরিচিত, ছিলেন ফিকহশাস্ত্রের একজন প্রখ্যাত বিশেষজ্ঞ এবং হিজরি প্রথম শতাব্দীর একজন গুরুত্বপূর্ণ ইসলামি ব্যক্তিত্ব। ইমাম আবু হানিফার বিষয়ে চতুর্থ খলিফা দোয়া করেছিলেন। ইসলামি ফিকহের সর্বাধিক প্রসিদ্ধ ও পরিচিত চারটি ""সুন্নি মাযহাবের"" একটি “হানাফি মাজহাব”-এর প্রধান ব্যক্তিত্ব ছিলেন তিনি। তিনি তার জ্ঞান এবং সম্মানের কারণে সুন্নি ইসলামে আল-ইমাম আল-আজম (সর্বশ্রেষ্ঠ ইমাম) নামে পরিচিত। এই উপাধি ইমাম আবু হানিফা ব্যতীত ইসলামের ইতিহাসে আর কাউকে দেয়া হয়নি।",https://bn.wikipedia.org/wiki/%E0%A6%86%E0%A6%AC%E0%A7%81_%E0%A6%B9%E0%A6%BE%E0%A6%A8%E0%A6%BF%E0%A6%AB%E0%A6%BE
238,কৃষ্ণ,"কৃষ্ণ (সংস্কৃত: कृष्ण) বা শ্রীকৃষ্ণ (সংস্কৃত: श्रीकृष्ण) হলেন বিষ্ণুর পূর্ণ অবতার। সনাতন তথা বৈষ্ণব ধর্মে তাঁকে সর্বোচ্চ ঈশ্বর (পরম সত্ত্বা) উপাধিতে ভূষিত করা হয় এবং তিনি ভগবদ্গীতা-এর প্রবর্তক। ভাদ্রমাসের কৃষ্ণপক্ষের অষ্টমী তিথিতে তাঁর জন্মোৎসব পালন করা হয়।তিনি দ্বাপর যুগে জন্মগ্রহণ করেন। তিনি তার অত্যাচারী মামা কংসকে হত্যা করেন।এছাড়াও তিনি পুতনা রাক্ষসী, অঘাসুর, বকাসুর ইত্যাদি অসুরকে হত্যা করেন। মহাভারতে তিনি অর্জুনের রথের সারথী ছিলেন।
""নারদ বললেন হে বাসুদেব আপনি সৌর,শাক্ত,শৈব, বৈষ্ণব ও গাণপত্য সবার উপাসনার উপাস্য ""
                        [মহা.শান্তিপর্ব--৩২৪/৪]
সনাতন ধর্মাবলম্বী, বিশেষত বৈষ্ণবদের কাছে জন্মাষ্টমী গুরুত্বপূর্ণ উৎসব। এই উৎসব নানা ভাবে উৎযাপন করা হয়, যেমন - ভগবত পুরাণ অনুযায়ী নৃত্য, নাটক যাকে বলা হয় রাসলীলা বা কৃষ্ণলীলা, মধ্যরাত্রি তে কৃষ্ণের জন্মের মুহূর্তে ধর্মীয় গীত গাওয়া, উপবাস, দহিহান্ডি প্রভৃতি।
অন্যদিকে দহিহান্ডি প্রথায় অনেক উঁচুতে মাখনের হাড়ি রাখা হয় এবং অনেক ছেলে মিলে মানুষের পিরামিড তৈরি করে সেই হাড়ি ভাঙ্গার চেষ্টা করে। তামিলনাড়ুতে এ প্রথা উড়িয়াদি নামে পরিচিত।
জন্মাষ্টমী বিশেষভাবে পালন করা হয় মথুরা এবং বৃন্দাবনে। তাছাড়া মণিপুর, আসাম, ত্রিপুরা, পশ্চিমবঙ্গ, ওড়িশা, মধ্যপ্রদেশ, রাজস্থান, মহারাষ্ট্র, কর্ণাটক, তামিলনাড়ু, অন্ধ্রপ্রদেশ, এবং ভারতবর্ষের অন্যান্য রাজ্যে যেখানে প্রচুর বৈষ্ণব সম্প্রদায়ের মানুষ থাকেন সেখানে পালন করা হয়। এছাড়াও বাংলাদেশের ঢাকা প্রভৃতি জায়গা ও অন্য দেশে জন্মাষ্টমী পালন করা হয়।
তিনি ধর্মরাষ্ট্র-প্রতিষ্ঠায় নেতৃত্ব দানকারী একজন প্রাচীন ভারতীয় রাজপুত্র ও রাজার ভূমিকায় আজ থেকে প্রায় ৫০০০ বৎসর পূর্বে অবতীর্ণ হন। ভিন্ন ধর্মের লোকেরা ভিন্ন দৃষ্টিকোণ থেকে শ্রীকৃষ্ণের আরাধনা করে থাকেন।
কৃষ্ণ শব্দের আক্ষরিক অর্থ কালো বা ঘন নীল। গৌড়ীয় বৈষ্ণব সম্প্রদায়ের হরে কৃষ্ণ মহামন্ত্রে, কৃষ্ণ শব্দটির আভিধানিক অর্থ সর্বাকর্ষক।
ভাগবত পুরাণে কৃষ্ণকে প্রায়শই বংশী-বাদনরত এক কিশোরের রূপে বর্ণনা করা হয়েছে। আবার ভগবদ্গীতায়, তিনি এক পথপ্রদর্শক রূপে দন্ডায়মান। সমগ্র মহাভারত কাব্যে, তিনি একজন কূটনীতিজ্ঞ হিসাবে পাণ্ডবপক্ষে মুখ্য ভূমিকা পালন করেছেন, কুরুক্ষেত্রের যুদ্ধে অর্জুনের রথের সারথিরূপে অবতীর্ণ হয়েছেন। দর্শন ও ধর্মতাত্ত্বিক ঐতিহ্যে শ্রীকৃষ্ণ-সংক্রান্ত উপাখ্যানগুলি বহুধা পরিব্যাপ্ত। তিনি একাধারে দেবগুণা শিশু, রঙ্গকৌতুকপ্রিয়, আদর্শ প্রেমিক, দিব্য নায়ক ও পরম ঈশ্বর। কৃষ্ণ-সংক্রান্ত উপাখ্যানগুলি মূলত লিখিত আছে মহাভারত, হরিবংশ, ভাগবত পুরাণ ও বিষ্ণু পুরাণ গ্রন্থে।
চতুর্থ খ্রিষ্টপূর্বাব্দ থেকেই বাসুদেব, কৃষ্ণ ও গোপাল প্রভৃতি কৃষ্ণের বিভিন্ন রূপের উপাসনাকারী বিভিন্ন সম্প্রদায়ের অস্তিত্বের কথা জানা যায়। খ্রিষ্টীয় নবম শতাব্দীতে দক্ষিণ ভারতে কৃষ্ণভক্তি আন্দোলন ছড়িয়ে পড়ে। উত্তর ভারতে কৃষ্ণধর্ম সম্প্রদায়গুলি সুপ্রতিষ্ঠিত হয় মোটামুটি একাদশ শতাব্দী নাগাদ। দশম শতাব্দী থেকেই ভক্তি আন্দোলনের ক্রমবিস্তারের ফলে কৃষ্ণ শিল্পকলার এক মুখ্য বিষয় হয়ে ওঠেন। ওড়িশায় জগন্নাথ, মহারাষ্ট্রে বিঠোবা, রাজস্থানে শ্রীনাথজি, অন্ধ্রপ্রদেশে ভেঙ্কাটেশ বালাজী প্রভৃতি শ্রীকৃষ্ণের রূপগুলিকে কেন্দ্র করে আঞ্চলিক ভক্তিসংস্কৃতিও বিকাশলাভ করে। তার প্রতি নিষ্ঠাযুক্ত ভক্তি ও তার অপ্রাকৃত লীলা থেকে সহজেই উপলব্ধি করতে পারা যায় যে, তিনিই পরমেশ্বর ভগবান স্বয়ং। বর্তমানে কৃষ্ণভাবনামৃত সংঘ (ইসকন) সমগ্র পৃথিবীতে শ্রীকৃষ্ণের মহিমা প্রচার এবং কৃষ্ণকেন্দ্রিক সমাজ প্রতিষ্ঠায় নিয়োজিত।",https://bn.wikipedia.org/wiki/%E0%A6%95%E0%A7%83%E0%A6%B7%E0%A7%8D%E0%A6%A3
239,উহুদের যুদ্ধ,"উহুদের যুদ্ধ (আরবি: غزوة أحد Ġazwat ‘Uḥud) ৩ হিজরির ৭ শাওয়াল (২৩ মার্চ ৬২৫ খ্রিষ্টাব্দ হিজরি ৩ শনিবার) উহুদ পর্বতের সংলগ্ন স্থানে সংঘটিত হয়। মদিনার মুসলিম ও মক্কার কুরাইশদের মধ্যে এই যুদ্ধ সংঘটিত হয়েছে। এই দুই পক্ষের নেতৃত্বে ছিলেন যথাক্রমে মুহাম্মাদ ও আবু সুফিয়ান। ইসলামের ইতিহাসে সংঘটিত প্রধান যুদ্ধসমূহের মধ্যে এটি দ্বিতীয়। এর পূর্বে ৬২৪ সালে এই দুইপক্ষের মধ্যে বদরের যুদ্ধ সংঘটিত হয়েছিল।
বদরের পরাজয়ের প্রতিশোধ নেয়ার জন্য মক্কার পক্ষ থেকে এই যুদ্ধের সূচনা করা হয়েছিল। যুদ্ধযাত্রার খবর পাওয়ার পর মুসলিমরাও তৈরী হয় এবং উহুদ পর্বত সংলগ্ন প্রান্তরে এই যুদ্ধ সংঘটিত হয়।
সংখ্যায় কম হওয়া সত্ত্বেও মুসলিমরা প্রথমদিকে সাফল্য লাভ করেছিল এবং মক্কার সৈনিকরা পিছু হটতে বাধ্য হয়। বিজয়ের খুব কাছাকাছি থাকা অবস্থায় মুসলিম বাহিনীর কিছু অংশের ভুল পদক্ষেপের কারণে যুদ্ধের মোড় ঘুরে যায়। মুহাম্মাদ মুসলিম তীরন্দাজদেরকে নির্দেশ দিয়েছিলেন যে ফলাফল যাই হোক তারা তাদের অবস্থান থেকে সরে না আসে। কিন্তু তারা অবস্থান ত্যাগ করার পর মক্কার বাহিনীর অন্যতম সেনাপতি খালিদ বিন ওয়ালিদ মুসলিমদের উপর আক্রমণের সুযোগ পান ফলে মুসলিমদের মধ্যে বিশৃঙ্খলা তৈরী হয়। এসময় অনেক মুসলিম নিহত হয়। মুহাম্মাদ নিজেও আহত হয়েছিলেন। মুসলিমরা উহুদ পর্বতের দিকে পিছু হটে আসে। মক্কার বাহিনীকে এরপর মক্কায় ফিরে আসে।
এই যুদ্ধে সংঘটিত হওয়ার পর ৬২৭ সালে দুই বাহিনী পুনরায় খন্দকের যুদ্ধে মুখোমুখি হয়।",https://bn.wikipedia.org/wiki/%E0%A6%89%E0%A6%B9%E0%A7%81%E0%A6%A6%E0%A7%87%E0%A6%B0_%E0%A6%AF%E0%A7%81%E0%A6%A6%E0%A7%8D%E0%A6%A7
240,কালো জাদু,"কালো জাদু হলো এমন এক ধরনের চর্চা যা অন্যের অনিষ্ট সাধনে কিংবা নিজের স্বার্থ সিদ্ধির জন্যে করা হয়। এটি অতিমানবিক ও অশুভ শক্তির সংশ্লিষ্টতা। কালো জাদু সাধারনত অতিমানবিক শক্তি দ্বারা করা হয়। তবে অনেকে বলেন এতে ভূত, প্রেত, আত্মা, প্রেতাত্মা ব্যবহার করা হয়। অর্থাৎ বলা হয়ে থাকে যে কালো জাদু দিয়ে ভুত, প্রেত, প্রেতাত্মা ইত্যাদি বশ করে তাদের দিয়ে নানা কাজ করা যায়। যারা কালো জাদু করে তাদের কালো জাদুকর বলা হয়।
কালো জাদু ঐতিহ্যগতভাবে অলৌকিক শক্তি বা মন্দ এবং স্বার্থপর উদ্দেশ্যের জন্য জাদুর ব্যবহার উল্লেখ করা হয়েছে। বাম দিকের পথ এবং ডান দিকের পথ ডাইকোটোমির ক্ষেত্রে, কালো জাদুটি দয়ালু সাদা জাদুটি দূষিত, বাম দিকের অংশ। আধুনিক সময়ে, কেউ কেউ ""কালো যাদু"" সংজ্ঞাটিকে ""কালো যাদু"" হিসাবে অস্বীকার করে। এমন যাদু বা রীতিগত অনুশীলনগুলিকে সংজ্ঞায়িত করে, তাদের দ্বারা সংকুচিত করা হয়েছে।",https://bn.wikipedia.org/wiki/%E0%A6%95%E0%A6%BE%E0%A6%B2%E0%A7%8B_%E0%A6%9C%E0%A6%BE%E0%A6%A6%E0%A7%81
241,জহির রায়হান,"জহির রায়হান (১৯ আগস্ট ১৯৩৫ — ৩০ জানুয়ারি ১৯৭২) ছিলেন একজন প্রখ্যাত বাংলাদেশী চলচ্চিত্র পরিচালক, ঔপন্যাসিক এবং গল্পকার। বাংলা সাহিত্যের গল্প শাখায় অবদানের জন্য তিনি ১৯৭২ সালে বাংলা একাডেমি সাহিত্য পুরস্কার লাভ করেন। চলচ্চিত্রে অবদানের জন্য বাংলাদেশ সরকার তাকে ১৯৭৭ সালে মরণোত্তর বাংলাদেশের দ্বিতীয় সর্বোচ্চ বেসামরিক সম্মাননা একুশে পদক এবং সাহিত্যে অবদানের জন্য ১৯৯২ সালে মরণোত্তর বাংলাদেশের সর্বোচ্চ বেসামরিক সম্মাননা স্বাধীনতা পুরস্কারে ভূষিত করে। চলচ্চিত্রে তার সামগ্রিক অবদানের জন্য ১৯৭৫ সালে ১ম জাতীয় চলচ্চিত্র পুরস্কারে তাকে মরণোত্তর বিশেষ পুরস্কার প্রদান করা হয়।
তার রচিত প্রথম উপন্যাস শেষ বিকেলের মেয়ে ১৯৬০ সালে প্রকাশিত হয়। তার রচিত অন্যান্য উল্লেখযোগ্য উপন্যাস হলো হাজার বছর ধরে ও আরেক ফাল্গুন। হাজার বছর ধরে উপন্যাসের জন্য তিনি ১৯৬৪ সালে আদমজী সাহিত্য পুরস্কার লাভ করেন। এই উপন্যাস অবলম্বনে নির্মিত চলচ্চিত্র জাতীয় পুরস্কার পায়। তার নির্মিত প্রথম চলচ্চিত্র কখনো আসেনি (১৯৬১)। ১৯৬৪ সালে কাঁচের দেয়াল চলচ্চিত্রের জন্য তিনি নিগার পুরস্কার লাভ করেন। তার নির্মিত অন্যান্য চলচ্চিত্রগুলো হলো বেহুলা, সঙ্গম, আনোয়ারা এবং জীবন থেকে নেয়া। স্টপ জেনোসাইড প্রামাণ্যচিত্রে বাংলাদেশের স্বাধীনতা যুদ্ধের ভয়াবহ চিত্র তুলে ধরে তিনি প্রশংসিত হয়েছিলেন।",https://bn.wikipedia.org/wiki/%E0%A6%9C%E0%A6%B9%E0%A6%BF%E0%A6%B0_%E0%A6%B0%E0%A6%BE%E0%A6%AF%E0%A6%BC%E0%A6%B9%E0%A6%BE%E0%A6%A8
