id,title,text,url
364,মৃত সাগর,"মৃত সাগর (হিব্রু ভাষায়: יָם הַמֶּלַח‎, Yam ha-Melah, ""Sea of Salt"", আবার হিব্রু ভাষায়: יָם הַמָּוֶת‎, Yam ha-Mavet, ""The Sea of Death"", এবং আরবি: البحر الميت ), এর পশ্চিমে পশ্চিম তীর এবং ইসরায়েল , পূর্বে জর্ডান । জিবুতির আসাল হ্রদের পর এটি বিশ্বের দ্বিতীয় সর্বোচ্চ লবণাক্ত পানির প্রাকৃতিক আধার। সমুদ্র পৃষ্ঠ থেকে ৪২০ মিটার(১,৩৭৮ ফিট) নিচে এটি পৃথিবীর নিম্নতম স্থলভূমি । এর লবণাক্ততা শতকরা ৩০ ভাগ এবং এটি সমুদ্রের পানির চাইতে ৮.৬ গুণ বেশি লবণাক্ত ।",https://bn.wikipedia.org/wiki/%E0%A6%AE%E0%A7%83%E0%A6%A4_%E0%A6%B8%E0%A6%BE%E0%A6%97%E0%A6%B0
365,জসীম উদ্‌দীন,"জসীম উদ্‌দীন (অন্যভাবে জসীমউদ্দীন; ১ জানুয়ারি ১৯০৩ – ১৪ মার্চ ১৯৭৬) একজন বাঙালি কবি, গীতিকার, ঔপন্যাসিক ও লেখক। 'পল্লীকবি' উপাধিতে ভূষিত, জসীম উদ্‌দীন আবহমান বাংলার সাংস্কৃতিক ঐতিহ্যে লালিত প্রথম পূর্ণাঙ্গ আধুনিক কবি। ঐতিহ্যবাহী বাংলা কবিতার মূল ধারাটিকে নগর সভায় নিয়ে আসার কৃতিত্ব জসীম উদ্‌দীনের। তার নকশী কাঁথার মাঠ ও সোজন বাদিয়ার ঘাট বাংলা ভাষার গীতিময় কবিতার উৎকৃষ্টতম নিদর্শনগুলোর অন্যতম।  তার কবিতা বিভিন্ন ভাষায় অনূদিত হয়েছে।  তার লেখা অসংখ্য পল্লিগীতি এখনো গ্রাম বাংলার মানুষের মুখে মুখে শোনা যায়। যথা:- আমার হার কালা করলাম রে, আমায় ভাসাইলি রে, বন্ধু কাজল ভ্রমরা রে ইত্যাদি।
কলকাতা বিশ্ববিদ্যালয় থেকে শিক্ষিত জসীম উদ্‌দীন ঢাকা বিশ্ববিদ্যালয়ে ৫ বছর শিক্ষকতা করেন; ১৯৪৪ সালে শিক্ষকতা ছেড়ে তিনি বঙ্গীয় প্রাদেশিক সরকার এবং পরে পূর্ব পাকিস্তান সরকারের প্রচার বিভাগের কর্মকর্তা হিসেবে যোগদান করেন এবং ১৯৬২ সালে অবসর গ্রহণ করেন। জসীম উদ্‌দীন ছিলেন প্রগতিশীল ও অসাম্প্রদায়িক চেতনার অধিকারী এবং সমাজতান্ত্রিক সমাজব্যবস্থার একজন দৃঢ় সমর্থক। তিনি ছিলেন পূর্ব পাকিস্তানের সাংস্কৃতিক আন্দোলনের অন্যতম পুরোধা।
জসীম উদ্‌দীন প্রেসিডেন্টের প্রাইড অব পারফরমেন্স পুরস্কার (১৯৫৮), বাংলাদেশ সরকারের একুশে পদক (১৯৭৬) ও স্বাধীনতা পুরস্কারে (মরণোত্তর, ১৯৭৮) ভূষিত হন। তিনি ১৯৭৪ সালে বাংলা একাডেমী সাহিত্য পুরস্কার প্রত্যাখ্যান করেন।",https://bn.wikipedia.org/wiki/%E0%A6%9C%E0%A6%B8%E0%A7%80%E0%A6%AE_%E0%A6%89%E0%A6%A6%E0%A7%8D%E2%80%8C%E0%A6%A6%E0%A7%80%E0%A6%A8
366,জগদীশ চন্দ্র বসু,"জগদীশচন্দ্র বসু, সিএসআই, সিআইই, এফআরএস (৩০ নভেম্বর ১৮৫৮ – ২৩ নভেম্বর ১৯৩৭) একজন ব্রিটিশ  ভারতীয় পদার্থবিদ, জীববিজ্ঞানী এবং কল্পবিজ্ঞান রচয়িতা ছিলেন৷ ভারতীয় উপমহাদেশে ব্যবহারিক এবং গবেষণাধর্মী বিজ্ঞানের সূচনা তার হাত ধরে হয় বলে মনে করা হয়৷ ইনস্টিটিউট অব ইলেকট্রিক্যাল অ্যান্ড ইলেকট্রনিক্স ইঞ্জিনিয়ার্স তাকে রেডিও বিজ্ঞানের একজন জনক হিসেবে অভিহিত করে৷",https://bn.wikipedia.org/wiki/%E0%A6%9C%E0%A6%97%E0%A6%A6%E0%A7%80%E0%A6%B6_%E0%A6%9A%E0%A6%A8%E0%A7%8D%E0%A6%A6%E0%A7%8D%E0%A6%B0_%E0%A6%AC%E0%A6%B8%E0%A7%81
367,মুহাম্মাদের বংশধারা,"মুহাম্মদ সাঃ বর্তমান সৌদি আরবে অবস্থিত মক্কা নগরীর কুরাইশ গোত্রের বনি হাশিম বংশে জন্মগ্রহণ করেন। তার জন্মের তারিখ ছিল ১২ ই রবিউল আওয়াল, ইংরেজি সন মোতাবেক ৫৭০ খ্রিষ্টাব্দে। প্রখ্যাত ইতিহাসবেত্তা উইলিয়াম মন্টগোমারি ওয়াট তার পুস্তকে ৫৭০ সনই ব্যবহার করেছেন। তবে নবীর প্রকৃত জন্মতারিখ বের করা বেশ কষ্টসাধ্য। এজন্যই এ নিয়ে মতবিরোধ রয়েছে। যেমন এক বর্ণনা মতে তার জন্ম ৫৭১ সালের ২০ বা ২২ শে এপ্রিল। সাইয়েদ সোলাইমান নদভী, সালমান মনসুরপুরী এবং মুহাম্মদ পাশা ফালাকির গবেষণায় এই তথ্য বেরিয়ে এসেছে। তবে শেষোক্ত মতই ঐতিহাসিক দৃষ্টিকোণ থেকে বেশি নির্ভরযোগ্য। যাই হোক, নবীর জন্মের বছরেই হস্তী যুদ্ধের ঘটনা ঘটে এবং সে সময় সম্রাট নরশেরওয়ার সিংহাসনে আরোহণের ৪০ বছর পূর্তি ছিল এ নিয়ে কারো মাঝে দ্বিমত নেই।",https://bn.wikipedia.org/wiki/%E0%A6%AE%E0%A7%81%E0%A6%B9%E0%A6%BE%E0%A6%AE%E0%A7%8D%E0%A6%AE%E0%A6%BE%E0%A6%A6%E0%A7%87%E0%A6%B0_%E0%A6%AC%E0%A6%82%E0%A6%B6%E0%A6%A7%E0%A6%BE%E0%A6%B0%E0%A6%BE
368,বিকল্পধারা বাংলাদেশ,"বিকল্পধারা বাংলাদেশ হচ্ছে বাংলাদেশের একটি রাজনৈতিক দল যেটি সাবেক প্রেসিডেন্ট ও বিএনপি সাংসদ ড. একিউএম বদরুদ্দোজা চৌধুরী ২০০৪ সালে গঠন করেন। ঘটনাক্রমে, ড.  বি. চৌধুরী ছিলেন বিএনপিরও প্রতিষ্ঠাতা সদস্য এবং তিনি বিএনপি থেকে বহিষ্কৃত হয়েছিলেন। নির্বাচনের সময় এই পার্টির প্রতীক হচ্ছে কুলা, একটি হাতে বানানো ধানঝাড়ুনি পাখা। মৈত্রীর ক্ষেত্রে এটি বর্তমানে রাজনৈতিক অবস্থানে আওয়ামী লীগের মিত্র   এবং জাতীয় সংসদে ২টি  আসন রয়েছে ।",https://bn.wikipedia.org/wiki/%E0%A6%AC%E0%A6%BF%E0%A6%95%E0%A6%B2%E0%A7%8D%E0%A6%AA%E0%A6%A7%E0%A6%BE%E0%A6%B0%E0%A6%BE_%E0%A6%AC%E0%A6%BE%E0%A6%82%E0%A6%B2%E0%A6%BE%E0%A6%A6%E0%A7%87%E0%A6%B6
369,মৌলসমূহের ইলেকট্রন বিন্যাস (উপাত্ত পাতা),"এই পৃষ্ঠাটি স্বাভাবিক গ্যাসীয় পরমাণুগুলির তাঁদের স্বাভাবিক অবস্থার ইলেকট্রন বিন্যাস দেখায়। প্রতিটি পরমাণুর জন্য উপশক্তিস্তর প্রথমে সংক্ষিপ্ত আকার দেওয়া হয়েছে, তারপর সব উপ শক্তিস্তরগুলি লেখা হয়েছে, তারপর শক্তিস্তর প্রতি ইলেকট্রনের সংখ্যা লেখা হয়েছে। হ্যাসিয়ামের (মৌল ১০৮) পরের ইলেকট্রন বিন্যাস অনুমিত।  


== তথ্যসূত্র ==",https://bn.wikipedia.org/wiki/%E0%A6%AE%E0%A7%8C%E0%A6%B2%E0%A6%B8%E0%A6%AE%E0%A7%82%E0%A6%B9%E0%A7%87%E0%A6%B0_%E0%A6%87%E0%A6%B2%E0%A7%87%E0%A6%95%E0%A6%9F%E0%A7%8D%E0%A6%B0%E0%A6%A8_%E0%A6%AC%E0%A6%BF%E0%A6%A8%E0%A7%8D%E0%A6%AF%E0%A6%BE%E0%A6%B8_(%E0%A6%89%E0%A6%AA%E0%A6%BE%E0%A6%A4%E0%A7%8D%E0%A6%A4_%E0%A6%AA%E0%A6%BE%E0%A6%A4%E0%A6%BE)
370,নরেন্দ্র মোদী,"নরেন্দ্র দামোদর দাস মোদী (গুজরাটি: નરેન્દ્ર દામોદરદાસ મોદી; জন্ম: ১৭ই সেপ্টেম্বর ১৯৫০) একজন ভারতীয় রাজনীতিবিদ। যিনি ২০১৪ সালের মে থেকে ভারতের চতুর্দশতম প্রধানমন্ত্রী হিসেবে দায়িত্ব পালন করছেন। মোদি ২০০১ থেকে ২০১৪ সাল পর্যন্ত গুজরাটের মুখ্যমন্ত্রী এবং উত্তরপ্রদেশের বারানসীর সংসদ সদস্য (এমপি) ছিলেন। তিনি ভারতীয় জনতা পার্টি (বিজেপি) রাজনৈতিক দলের সদস্য। তিনি ২০১৪ খ্রিষ্টাব্দে অনুষ্ঠিত ষোড়শ সাধারণ নির্বাচনে ভারতীয় জনতা পার্টিকে নেতৃত্ব প্রদানের মাধ্যমে জয়লাভ লাভ করেছিলেন।
২০১৪ সালের ভারতীয় সাধারণ নির্বাচনে মোদি বিজেপির নেতৃত্ব দেন, যেখানে ১৯৮৪ সালের পর এটি প্রথমবারের মতো কোনো একক দলের জন্য দলটি ভারতীয় সংসদের নিম্নকক্ষ লোকসভায় সংখ্যাগরিষ্ঠতা অর্জন করে। তার প্রশাসন ভারতীয় অর্থনীতিতে সরাসরি বিদেশী বিনিয়োগ বাড়াতে এবং স্বাস্থ্যসেবা, শিক্ষা এবং সমাজকল্যাণমূলক কর্মসূচিতে ব্যয় কমানোর চেষ্টা করেছে। তিনি পরিকল্পনা কমিশনকে বিলুপ্ত করে এবং এটিকে নীতি আয়োগ দিয়ে প্রতিস্থাপন করে ক্ষমতা কেন্দ্রীভূত করেন। মোদি একটি হাই-প্রোফাইল স্যানিটেশন অভিযান শুরু করেছিলেন, ২০১৬ সালে উচ্চ মূল্যের নোটের নোট বাতিলের সূচনা করেছিলেন এবং পণ্য ও পরিষেবা কর এবং দুর্বল বা বিলুপ্ত পরিবেশ ও শ্রম আইন চালু করেছিলেন।
২০০২ খ্রিষ্টাব্দের গুজরাত দাঙ্গার ঘটনায় তার প্রশাসন সমালোচিত হওয়ায় ভারত ও বিদেশে তার সমালোচনা হয়। কিন্তু গুজরাতের অর্থনৈতিক উন্নতির বৃদ্ধিতে সহায়ক পরিবেশ গঠনের জন্য তিনি তার আর্থিক নীতির জন্য প্রশংসিত হয়েছেন। অন্যদিকে তার রাজ্যের মানবোন্নয়নের ওপর গঠনমূলক প্রভাব বিস্তারে তার প্রশাসনের অক্ষমতার জন্য তিনি সমালোচিতও হয়েছেন।",https://bn.wikipedia.org/wiki/%E0%A6%A8%E0%A6%B0%E0%A7%87%E0%A6%A8%E0%A7%8D%E0%A6%A6%E0%A7%8D%E0%A6%B0_%E0%A6%AE%E0%A7%8B%E0%A6%A6%E0%A7%80
371,আনন্দবাজার পত্রিকা,"আনন্দবাজার পত্রিকা পশ্চিমবঙ্গ থেকে বাংলা ভাষায় প্রকাশিত একটি শতাব্দী প্রাচীন ভারতীয় দৈনিক পত্রিকা। কলকাতার এবিপি প্রাইভেট লিমিটেড এর প্রকাশক। প্রকাশ-সংখ্যার ভিত্তিতে এটি ভারতে বাংলা ভাষায় বহুল প্রচারিত দৈনিক। কলকাতা, নয়া দিল্লি, ভুবনেশ্বর, রাঁচি, শিলিগুড়ি ও ভারতের অন্যান্য শহর থেকে নিয়মিত এটি দশ লক্ষেরও অধিক সংখ্যায় প্রচারিত হয়। ইন্ডিয়ান রিডারশিপ সার্ভে অনুসারে, পত্রিকাটি ১৫৬ লাখ মানুষ পাঠ করেন।",https://bn.wikipedia.org/wiki/%E0%A6%86%E0%A6%A8%E0%A6%A8%E0%A7%8D%E0%A6%A6%E0%A6%AC%E0%A6%BE%E0%A6%9C%E0%A6%BE%E0%A6%B0_%E0%A6%AA%E0%A6%A4%E0%A7%8D%E0%A6%B0%E0%A6%BF%E0%A6%95%E0%A6%BE
372,ফিফা ফুটসাল বিশ্বকাপ,"ফিফা ফুটসাল বিশ্বকাপ হলো ফিফা কর্তৃক আয়োজিত পুরুষদের সর্বোচ্চ ফুটসাল প্রতিযোগিতা। ১৯৮৯ সালে সর্বপ্রথম অনুষ্ঠিত হয়েছিল নেদারল্যান্ডসে। ১৯৯২ সালে থেকে প্রতি চার বছর অন্তর এই প্রতিযোগিতাটি অনুষ্ঠিত হচ্ছে। প্রতি দুটি ফুটবল বিশ্বকাপের মাঝের বছরে অনুষ্ঠিত হয়। বর্তমান চ্যাম্পিয়ন পর্তুগাল।
২০০৮-এর আগের সমস্ত আসর ছিল ১৬-দলের আসর। প্রথম ইভেন্টে ইউরোপ থেকে ৬টি, দক্ষিণ আমেরিকার ৩টি, আফ্রিকা থেকে ২টি, এশিয়া থেকে ২টি, উত্তর ও মধ্য আমেরিকার ২টি এবং ওশেনিয়া থেকে ১টি দল অংশগ্রহণ করেছিল। ২০১২ সাল থেকে, এতে ২৪ টি দল বিভক্ত হয়ে একটি ছয়টি গ্রুপের রাউন্ড-রবিন টুর্নামেন্টে প্রতিটি গ্রুপে চারটি দল রয়েছে। প্রতিটি গ্রুপের শীর্ষ দুটি দল, ৪টি সর্বোচ্চ র‍্যাঙ্কযুক্ত তৃতীয় স্থানাধিকারীর সাথে, একটি ষোল দলের নকআউট পর্বে উঠেছে।",https://bn.wikipedia.org/wiki/%E0%A6%AB%E0%A6%BF%E0%A6%AB%E0%A6%BE_%E0%A6%AB%E0%A7%81%E0%A6%9F%E0%A6%B8%E0%A6%BE%E0%A6%B2_%E0%A6%AC%E0%A6%BF%E0%A6%B6%E0%A7%8D%E0%A6%AC%E0%A6%95%E0%A6%BE%E0%A6%AA
373,উয়ারী-বটেশ্বর,"উয়ারী-বটেশ্বর বাংলাদেশের রাজধানী ঢাকা শহর থেকে ৭০ কিলোমিটার উত্তর-পূর্বে নরসিংদীর বেলাবো ও শিবপুর উপজেলায় অবস্থিত উয়ারী ও বটেশ্বর নামীয় দুটি গ্রামব্যাপী একটি প্রত্নতাত্ত্বিক স্থান। ধারণা করা হয় এটি মাটির নিচে অবস্থিত একটি দুর্গ-নগরী। বিশেষজ্ঞদের ধারণা অনুযায়ী এটি প্রায় আড়াই হাজার বছরের পুরনো। তবে ২০০০ খ্রিষ্টাব্দে আবিষ্কৃত কিছু প্রত্ন নিদর্শনে মার্কিন যুক্তরাষ্ট্র, নেদারল্যান্ড এবং নিউজিল্যান্ড তিনটি দেশের পরীক্ষাগারে কার্বন-১৪ পরীক্ষার প্রেক্ষিতে উয়ারীর বসতিকে খ্রিষ্টপূর্ব ৪৫০ অব্দের বলে নিশ্চিত করা হয়েছে।
বাংলাদেশ সরকারের প্রত্নতত্ত্ব অধিদপ্তর উয়ারী-বটেশ্বর এলাকায় উৎখনন কর্ম চলমান রেখেছে। সর্বশেষ ২ জানুয়ারি ২০১৭ তারিখে উয়ারীতে উৎখনন কালে বেশ কিছু প্রত্ননিদর্শন সংগৃহীত হয়েছে।",https://bn.wikipedia.org/wiki/%E0%A6%89%E0%A6%AF%E0%A6%BC%E0%A6%BE%E0%A6%B0%E0%A7%80-%E0%A6%AC%E0%A6%9F%E0%A7%87%E0%A6%B6%E0%A7%8D%E0%A6%AC%E0%A6%B0
